{
  "$schema": "https://json-schema.org/draft/2020-12/schema",
  "$id": "https://example.local/facility-war/sim_run.schema.json",
  "type": "object",
  "required": [
    "run_id",
    "graph_hash",
    "scenario_id",
    "trial_count",
    "seed",
    "started_at",
    "finished_at",
    "per_bom_item_distribution",
    "mitigation_candidates"
  ],
  "additionalProperties": false,
  "properties": {
    "run_id": {
      "type": "string",
      "minLength": 1
    },
    "graph_hash": {
      "type": "string",
      "pattern": "^[a-f0-9]{64}$"
    },
    "scenario_id": {
      "type": "string"
    },
    "trial_count": {
      "type": "integer",
      "minimum": 1
    },
    "seed": {
      "type": "integer"
    },
    "started_at": {
      "type": "string"
    },
    "finished_at": {
      "type": "string"
    },
    "max_tier": {
      "type": "integer",
      "minimum": 1,
      "maximum": 4
    },
    "horizon_weeks": {
      "type": "integer",
      "minimum": 1
    },
    "shock_draw_summary": {
      "type": "object",
      "required": ["duration_weeks", "severity"],
      "additionalProperties": false,
      "properties": {
        "duration_weeks": {
          "$ref": "#/$defs/draw_summary"
        },
        "severity": {
          "$ref": "#/$defs/draw_summary"
        }
      }
    },
    "per_bom_item_distribution": {
      "type": "object",
      "minProperties": 1,
      "additionalProperties": {
        "type": "object",
        "required": [
          "outage_weeks",
          "expected_red_weeks",
          "probability_any_red_week",
          "status_share"
        ],
        "additionalProperties": false,
        "properties": {
          "outage_weeks": {
            "type": "object",
            "additionalProperties": {
              "type": "integer",
              "minimum": 0
            }
          },
          "expected_red_weeks": {
            "type": "number",
            "minimum": 0
          },
          "probability_any_red_week": {
            "type": "number",
            "minimum": 0,
            "maximum": 1
          },
          "status_share": {
            "type": "object",
            "required": ["green", "amber", "red"],
            "additionalProperties": false,
            "properties": {
              "green": {
                "type": "number",
                "minimum": 0,
                "maximum": 1
              },
              "amber": {
                "type": "number",
                "minimum": 0,
                "maximum": 1
              },
              "red": {
                "type": "number",
                "minimum": 0,
                "maximum": 1
              }
            }
          }
        }
      }
    },
    "mitigation_method": {
      "type": "string",
      "minLength": 1
    },
    "mitigation_candidates": {
      "type": "array",
      "items": {
        "type": "object",
        "required": [
          "mitigation_id",
          "type",
          "target",
          "expected_reduction_weeks",
          "rationale"
        ],
        "additionalProperties": false,
        "properties": {
          "mitigation_id": {
            "type": "string"
          },
          "type": {
            "type": "string",
            "enum": ["dual_source", "buffer", "redesign"]
          },
          "target": {
            "type": "string"
          },
          "expected_reduction_weeks": {
            "type": "number",
            "minimum": 0
          },
          "evaluated_bom_item": {
            "type": "string"
          },
          "effective_after_weeks": {
            "type": "integer",
            "minimum": 0
          },
          "residual_expected_red_weeks": {
            "type": "number",
            "minimum": 0
          },
          "residual_probability_any_red_week": {
            "type": "number",
            "minimum": 0,
            "maximum": 1
          },
          "rationale": {
            "type": "string"
          }
        }
      }
    }
  },
  "$defs": {
    "draw_summary": {
      "type": "object",
      "required": ["min", "mean", "max"],
      "additionalProperties": false,
      "properties": {
        "min": {
          "type": "number"
        },
        "mean": {
          "type": "number"
        },
        "max": {
          "type": "number"
        }
      }
    }
  }
}
